{
  "$schema": "http://json-schema.org/draft-04/schema#",
  "type": "object",
  "properties": {
    "internalTypeName": {
      "type": "string",
      "description": "The internal name of the type the attribute belongs to."
    },
    "internalName": {
      "type": "string",
      "description": "The internal name of the attribute, which is used in the database. Internal names usually contain only lowercase and uppercase letters and dots. They are similar to java package names."
    },
    "localizedName": {
      "type": "object",
      "properties": {
        "en": {
          "type": "string"
        },
        "de": {
          "type": "string"
        }
      },
      "description": "The localized name of the attribute, which is used in the user interface.",
      "required": [
        "en",
        "de"
      ],
      "additionalProperties": false
    },
    "shortHelp": {
      "type": [
        "object",
        "null"
      ],
      "properties": {
        "en": {
          "type": "string"
        },
        "de": {
          "type": "string"
        }
      },
      "description": "Short help text for the attribute, which explains the meaning of the attribute in a few words and is shown in the UI.",
      "required": [
        "en",
        "de"
      ],
      "additionalProperties": false
    },
    "constraint": {
      "type": "object",
      "properties": {
        "attributeType": {
          "type": "string",
          "enum": ["date"]
        },
        "specificity": {
          "type": "string",
          "enum": [
            "YEAR",
            "QUARTER",
            "MONTH",
            "WEEK",
            "DAY"
          ]
        },
        "dateFormat": {
          "type": "string",
          "enum": [
            "YEAR_SHORT",
            "YEAR_LONG",
            "QUARTER_SLASH_YEAR_SHORT",
            "QUARTER_SLASH_YEAR_LONG",
            "QUARTER_DOT_YEAR_SHORT",
            "QUARTER_DOT_YEAR_LONG",
            "MONTH_SHORT_YEAR_SHORT",
            "MONTH_SHORT",
            "MONTH_FULL",
            "MONTH_LONG",
            "MONTH_SHORT_YEAR_LONG",
            "MONTH_SHORT_YEAR_SHORT_UNIFORM",
            "WEEK_YEAR_SHORT",
            "WEEK_YEAR_LONG",
            "DAY_ALL_SHORT",
            "DAY_YEAR_LONG",
            "DAY_MONTH_YEAR_LONG",
            "DAY_NO_YEAR_UNIFORM",
            "DAY_YEAR_SHORT_UNIFORM",
            "DAY_YEAR_LONG_UNIFORM",
            "ISO_8601",
            "ISO_8601_RAW",
            "DAY_WEEK_WEEKDAY_YEAR"
          ]
        }
      },
      "required": [
        "attributeType",
        "specificity",
        "dateFormat"
      ],
      "additionalProperties": false
    },
    "multiplicity": {
      "type": "string",
      "description": "Specifies the multiplicity/cardinality of the attribute.",
      "enum": [
        "maximalOne",
        "exactlyOne",
        "anyNumber",
        "atLeastOne"
      ]
    }
  },
  "required": [
    "internalTypeName",
    "internalName",
    "localizedName",
    "constraint",
    "multiplicity"],
  "additionalProperties": false
}