{
  "internalTypeName": "cf.cplace.solution.safe.program",
  "internalName": "cf.cplace.solution.safe.plannedStart",
  "localizedName": {
    "en": "Planned Start",
    "de": "Geplanter Start"
  },
  "constraint": {
    "specificity": "DAY",
    "dateFormat": "DAY_YEAR_LONG",
    "attributeType": "date"
  },
  "multiplicity": "maximalOne"
}
